{
  "meta": {
    "task_id": "task-5d609339e218",
    "trace_id": "task-5d609339e218",
    "stage": "tests",
    "generated_at": "2026-02-09T02:47:38.431911+00:00",
    "source_language": "COBOL",
    "target_language": "Java",
    "module": "UNKNOWN"
  },
  "unknowns": [
    {
      "field": "expected_outputs",
      "reason": "期待値が未指定"
    }
  ],
  "extensions": {},
  "test_cases": [
    {
      "name": "default",
      "inputs": {},
      "expected_outputs": {},
      "description": "既定の等価性確認ケース"
    }
  ],
  "golden_master": {
    "default": {}
  },
  "evidence": {
    "source_of_truth": "expected_outputs",
    "case_count": 1
  }
}